<?xml version="1.0" encoding="utf-8"?>
<!DOCTYPE testFile SYSTEM "../../testFile.dtd">
<testFile totalQuestion="2" lastUse="0" fileName="ManagingInheritanceTest_javatutorial_A_activity.xml" name="Test for Managing Inheritance" course="javatutorial" type="activity" execution="adaptive" path="javatutorial/test/ManagingInheritanceTest_javatutorial_A_activity.xml" enable="true"><concepts><concept value="javatutorial.ManagingInheritanceTest" /></concepts><questions numberOfFiles="1"><questionsFile numberOfQuestions="2" path="javatutorial/itemsFiles/ManagingInheritanceTest_javatutorial_items.xml" concept="javatutorial.ManagingInheritanceTest"><question codeQuestion="1" /><question codeQuestion="2" /></questionsFile></questions><parameters><runningParameters><presentationParameters><showInitialInfo value="true" /><questionsOrder value="SEQUENTIAL" /><answersOrder value="SEQUENTIAL" /><showQuestionCorrection value="false" /><verbose value="false" /><showCorrectAnswers value="false" /><timeOfAnswer value="60" /><repeatWithoutAnswer value="false" /><showFinalInfo value="true" /></presentationParameters><htmlParameters><bgColor value="#FFFFFF" /><background value="" /><titleColor value="#000000" /></htmlParameters><evaluationParameters><incorrectAnswer value="2" penalize="true" /><withoutAnswer value="0" penalize="false" /><knowledgePercentage value="100" /></evaluationParameters></runningParameters><irtParameters><start initialProficiency="0.5" /><continuation irtModel="3" /><stop value="standardError" standardError="0.33" /></irtParameters></parameters></testFile>
