<?xml version="1.0" encoding="utf-8"?>
<!DOCTYPE testFile SYSTEM "../../testFile.dtd">
<testFile totalQuestion="2" lastUse="12/10/2009" fileName="VariablesTest_javatutorial_A_activity.xml" name="Test for Variables" course="javatutorial" type="activity" execution="adaptive" path="javatutorial/test/VariablesTest_javatutorial_A_activity.xml" enable="true"><concepts><concept value="javatutorial.VariablesTest" /></concepts><questions numberOfFiles="1"><questionsFile numberOfQuestions="2" path="javatutorial/itemsFiles/VariablesTest_javatutorial_items.xml" concept="javatutorial.VariablesTest"><question codeQuestion="1" /><question codeQuestion="2" /></questionsFile></questions><parameters><runningParameters><presentationParameters><showInitialInfo value="true" /><questionsOrder value="RANDOM" /><answersOrder value="RANDOM" /><showQuestionCorrection value="false" /><verbose value="false" /><showCorrectAnswers value="false" /><timeOfAnswer value="180" /><repeatWithoutAnswer value="false" /><showFinalInfo value="true" /></presentationParameters><htmlParameters><bgColor value="#FFFFFF" /><background value="" /><titleColor value="#0000ff" /></htmlParameters><evaluationParameters><incorrectAnswer value="2" penalize="true" /><withoutAnswer value="0" penalize="false" /><knowledgePercentage value="100" /></evaluationParameters></runningParameters><irtParameters><start initialProficiency="0.5" /><continuation irtModel="3" /><stop value="standardError" standardError="0.33" /></irtParameters></parameters></testFile>
