<?xml version="1.0" encoding="utf-8"?>
<!DOCTYPE testFile SYSTEM "../../testFile.dtd">
<testFile totalQuestion="3" lastUse="12/10/2009" fileName="GettingStartedTest_javatutorial_A_activity.xml" name="Test for Getting Started" course="javatutorial" type="activity" execution="adaptive" path="javatutorial/test/GettingStartedTest_javatutorial_A_activity.xml" enable="true"><concepts><concept value="javatutorial.GettingStartedTest" /></concepts><questions numberOfFiles="1"><questionsFile numberOfQuestions="3" path="javatutorial/itemsFiles/GettingStartedTest_javatutorial_items.xml" concept="javatutorial.GettingStartedTest"><question codeQuestion="1" /><question codeQuestion="2" /><question codeQuestion="3" /></questionsFile></questions><parameters><runningParameters><presentationParameters><showInitialInfo value="true" /><questionsOrder value="RANDOM" /><answersOrder value="RANDOM" /><showQuestionCorrection value="false" /><verbose value="true" /><showCorrectAnswers value="true" /><timeOfAnswer value="60" /><repeatWithoutAnswer value="false" /><showFinalInfo value="true" /></presentationParameters><htmlParameters><bgColor value="#ffffff" /><background value="" /><titleColor value="#000066" /></htmlParameters><evaluationParameters><incorrectAnswer value="2" penalize="true" /><withoutAnswer value="0" penalize="false" /><knowledgePercentage value="100" /></evaluationParameters></runningParameters><irtParameters><start initialProficiency="0.5" /><continuation irtModel="3" /><stop value="standardError" standardError="0.33" /></irtParameters></parameters></testFile>
