<?xml version="1.0" encoding="ISO-8859-1"?>
<!DOCTYPE testFile SYSTEM "../../testFile.dtd">
<testFile totalQuestion="3" lastUse="9/11/2004" fileName="testtutorial_tutorial_C_activity.xml" name="testtutorial evaluation Test" course="tutorial" type="activity" execution="classic" path="tutorial/test/testtutorial_tutorial_C_activity.xml" enable="true"><concepts><concept value="tutorial.testtutorial" /></concepts><questions numberOfFiles="1"><questionsFile numberOfQuestions="3" path="tutorial/itemsFiles/testtutorial_tutorial_items.xml" concept="tutorial.testtutorial"><question codeQuestion="3" /><question codeQuestion="2" /><question codeQuestion="1" /></questionsFile></questions><parameters><runningParameters><presentationParameters><showInitialInfo value="true" /><questionsOrder value="RANDOM" /><answersOrder value="RANDOM" /><showQuestionCorrection value="true" /><verbose value="true" /><showCorrectAnswers value="true" /><timeOfAnswer value="60" /><repeatWithoutAnswer value="false" /><showFinalInfo value="true" /></presentationParameters><htmlParameters><bgColor value="#FFFFFF" /><background value="" /><titleColor value="#000000" /></htmlParameters><evaluationParameters><incorrectAnswer value="0" penalize="false" /><withoutAnswer value="0" penalize="false" /><knowledgePercentage value="100" /></evaluationParameters></runningParameters></parameters></testFile>
